{
  "department_code": "B3020",
  "department_name": "機械與機電工程學系",
  "degree_level": "bachelor",
  "entry_academic_year": "114",
  "minimum_graduation_credits": 137,
  "required_course_ratio": null,
  "source": {
    "url": "https://selcrs.nsysu.edu.tw/stu_query/crs_mst_qry/crs_mst_query.asp?action=3&YY1=114&DPT1=B3020",
    "retrieved_at": "2026-08-22T15:34:07Z",
    "binary_sha256": "094a7aea8a30506456574b77d6a2e7ef0e96fc723d4ab038ef17a4af5a695176",
    "http_status": 200,
    "parser_version": "graduation-rules-1.0.0"
  }
}
