{
  "department_code": "B6060",
  "department_name": "政治經濟學系",
  "degree_level": "bachelor",
  "entry_academic_year": "115",
  "minimum_graduation_credits": 136,
  "required_course_ratio": 55.88,
  "source": {
    "url": "https://selcrs.nsysu.edu.tw/stu_query/crs_mst_qry/crs_mst_query.asp?action=3&YY1=115&DPT1=B6060",
    "retrieved_at": "2026-08-15T13:43:45Z",
    "binary_sha256": "54511b8004b50bcc886e41088092062f2578a758b10e87087d21c023a30bcab1",
    "http_status": 200,
    "parser_version": "1.0.0"
  }
}
