{
  "department_code": "B8060",
  "department_name": "生物醫學科技學系全英語學士班",
  "degree_level": "bachelor",
  "entry_academic_year": "114",
  "minimum_graduation_credits": 128,
  "required_course_ratio": null,
  "source": {
    "url": "https://selcrs.nsysu.edu.tw/stu_query/crs_mst_qry/crs_mst_query.asp?action=3&YY1=114&DPT1=B8060",
    "retrieved_at": "2026-08-22T15:34:07Z",
    "binary_sha256": "b00858733c1461c781e49949f2c91c980dfd6fb59b67b16f65224a4d0902228e",
    "http_status": 200,
    "parser_version": "graduation-rules-1.0.0"
  }
}
