{
  "department_code": "B4020",
  "department_name": "資訊管理學系",
  "degree_level": "bachelor",
  "entry_academic_year": "115",
  "minimum_graduation_credits": 135,
  "required_course_ratio": 67.41,
  "source": {
    "url": "https://selcrs.nsysu.edu.tw/stu_query/crs_mst_qry/crs_mst_query.asp?action=3&YY1=115&DPT1=B4020",
    "retrieved_at": "2026-08-24T13:41:35Z",
    "binary_sha256": "4c557cacbe44d6ae3d78e68a4d382ba105710c9eceec6cf1d3488fc8db575a4d",
    "http_status": 200,
    "parser_version": "graduation-rules-1.0.0"
  }
}
