{
  "department_code": "B1030",
  "department_name": "音樂學系",
  "degree_level": "bachelor",
  "entry_academic_year": "113",
  "minimum_graduation_credits": 128,
  "required_course_ratio": null,
  "source": {
    "url": "https://selcrs.nsysu.edu.tw/stu_query/crs_mst_qry/crs_mst_query.asp?action=3&YY1=113&DPT1=B1030",
    "retrieved_at": "2026-08-24T13:41:34Z",
    "binary_sha256": "992d4fc5fd2f0d1651d1f368d54124a4c067f2578c7b73fe53a6cd75d2345e3b",
    "http_status": 200,
    "parser_version": "graduation-rules-1.0.0"
  }
}
