{
  "department_code": "B2010",
  "department_name": "生物科學系",
  "degree_level": "bachelor",
  "entry_academic_year": "113",
  "minimum_graduation_credits": 128,
  "required_course_ratio": null,
  "source": {
    "url": "https://selcrs.nsysu.edu.tw/stu_query/crs_mst_qry/crs_mst_query.asp?action=3&YY1=113&DPT1=B2010",
    "retrieved_at": "2026-08-22T15:34:07Z",
    "binary_sha256": "4e07bb22485b8b9ced6e4faa698a4dde796f5109cb2a6891cb26aac959bb8a7a",
    "http_status": 200,
    "parser_version": "graduation-rules-1.0.0"
  }
}
