{
  "department_code": "B3090",
  "department_name": "光電工程學系",
  "degree_level": "bachelor",
  "entry_academic_year": "114",
  "minimum_graduation_credits": 134,
  "required_course_ratio": null,
  "source": {
    "url": "https://selcrs.nsysu.edu.tw/stu_query/crs_mst_qry/crs_mst_query.asp?action=3&YY1=114&DPT1=B3090",
    "retrieved_at": "2026-08-24T13:41:34Z",
    "binary_sha256": "3cf47ccd70836893a31251aa265949c6fffd1bbfed51b8898ceb97b87bc3c1e8",
    "http_status": 200,
    "parser_version": "graduation-rules-1.0.0"
  }
}
