{
  "department_code": "B3100",
  "department_name": "材料與光電科學學系",
  "degree_level": "bachelor",
  "entry_academic_year": "113",
  "minimum_graduation_credits": 132,
  "required_course_ratio": null,
  "source": {
    "url": "https://selcrs.nsysu.edu.tw/stu_query/crs_mst_qry/crs_mst_query.asp?action=3&YY1=113&DPT1=B3100",
    "retrieved_at": "2026-08-22T15:34:07Z",
    "binary_sha256": "1945f81d3fef5205ebf74be97e58f545f7bb426d3ab31a6e04839fdc4a84710b",
    "http_status": 200,
    "parser_version": "graduation-rules-1.0.0"
  }
}
