{
  "department_code": "B6090",
  "department_name": "社會學系",
  "degree_level": "bachelor",
  "entry_academic_year": "115",
  "minimum_graduation_credits": 128,
  "required_course_ratio": 46.09,
  "source": {
    "url": "https://selcrs.nsysu.edu.tw/stu_query/crs_mst_qry/crs_mst_query.asp?action=3&YY1=115&DPT1=B6090",
    "retrieved_at": "2026-08-24T13:41:35Z",
    "binary_sha256": "20928088bd373c22153fbd7c25a45b2a0135230f2a131e6a9d2e86fefe6bf6b8",
    "http_status": 200,
    "parser_version": "graduation-rules-1.0.0"
  }
}
