{
  "department_code": "B8070",
  "department_name": "護理學系",
  "degree_level": "bachelor",
  "entry_academic_year": "114",
  "minimum_graduation_credits": 128,
  "required_course_ratio": null,
  "source": {
    "url": "https://selcrs.nsysu.edu.tw/stu_query/crs_mst_qry/crs_mst_query.asp?action=3&YY1=114&DPT1=B8070",
    "retrieved_at": "2026-08-22T15:34:07Z",
    "binary_sha256": "559ace40acf805440c7532c34d9b3677816e32fb019013e4255d78cf529e72d4",
    "http_status": 200,
    "parser_version": "graduation-rules-1.0.0"
  }
}
