{
  "department_code": "B1010",
  "department_name": "中國文學系",
  "degree_level": "bachelor",
  "entry_academic_year": "115",
  "minimum_graduation_credits": 128,
  "required_course_ratio": 60.94,
  "source": {
    "url": "https://selcrs.nsysu.edu.tw/stu_query/crs_mst_qry/crs_mst_query.asp?action=3&YY1=115&DPT1=B1010",
    "retrieved_at": "2026-08-15T13:43:45Z",
    "binary_sha256": "9b6348e703b600cec0ba0a4a8a774c5854e4b73c44c4c786a22f8d88a16f2165",
    "http_status": 200,
    "parser_version": "1.0.0"
  }
}
