{
  "department_code": "B2040",
  "department_name": "應用數學系",
  "degree_level": "bachelor",
  "entry_academic_year": "112",
  "minimum_graduation_credits": 128,
  "required_course_ratio": null,
  "source": {
    "url": "https://selcrs.nsysu.edu.tw/stu_query/crs_mst_qry/crs_mst_query.asp?action=3&YY1=112&DPT1=B2040",
    "retrieved_at": "2026-08-22T15:34:07Z",
    "binary_sha256": "09404ba410bab9c7d667c301be8e85d5ce2842db51f8cda50b7d708398ddd4a4",
    "http_status": 200,
    "parser_version": "graduation-rules-1.0.0"
  }
}
