{
  "department_code": "B3240",
  "department_name": "資訊工程學系全英語學士班",
  "degree_level": "bachelor",
  "entry_academic_year": "115",
  "minimum_graduation_credits": 135,
  "required_course_ratio": 57.78,
  "source": {
    "url": "https://selcrs.nsysu.edu.tw/stu_query/crs_mst_qry/crs_mst_query.asp?action=3&YY1=115&DPT1=B3240",
    "retrieved_at": "2026-08-22T15:34:07Z",
    "binary_sha256": "2371c71b43d59a66991f1c184eae8a532c8aa9c3a33247354ecd20c593d55e6b",
    "http_status": 200,
    "parser_version": "graduation-rules-1.0.0"
  }
}
