{
  "department_code": "B5040",
  "department_name": "海洋環境及工程學系",
  "degree_level": "bachelor",
  "entry_academic_year": "112",
  "minimum_graduation_credits": 128,
  "required_course_ratio": null,
  "source": {
    "url": "https://selcrs.nsysu.edu.tw/stu_query/crs_mst_qry/crs_mst_query.asp?action=3&YY1=112&DPT1=B5040",
    "retrieved_at": "2026-08-24T13:41:33Z",
    "binary_sha256": "d5134e58a4a1e9b06974b40e8357a0db882a95533db89efb454d4223489e256d",
    "http_status": 200,
    "parser_version": "graduation-rules-1.0.0"
  }
}
