{
  "department_code": "B3090",
  "department_name": "光電工程學系",
  "degree_level": "bachelor",
  "entry_academic_year": "115",
  "minimum_graduation_credits": 134,
  "required_course_ratio": 66.42,
  "source": {
    "url": "https://selcrs.nsysu.edu.tw/stu_query/crs_mst_qry/crs_mst_query.asp?action=3&YY1=115&DPT1=B3090",
    "retrieved_at": "2026-08-24T13:41:35Z",
    "binary_sha256": "0849b2175ad0a1b9ffd9d0b1c195e96986a47e4e02bd5a1fa3bfa97f2f98730b",
    "http_status": 200,
    "parser_version": "graduation-rules-1.0.0"
  }
}
