{
  "department_code": "B3100",
  "department_name": "材料與光電科學學系",
  "degree_level": "bachelor",
  "entry_academic_year": "115",
  "minimum_graduation_credits": 132,
  "required_course_ratio": 68.18,
  "source": {
    "url": "https://selcrs.nsysu.edu.tw/stu_query/crs_mst_qry/crs_mst_query.asp?action=3&YY1=115&DPT1=B3100",
    "retrieved_at": "2026-08-24T13:41:35Z",
    "binary_sha256": "67e6962fd5d6ca7e46bca8f1129ea741a6ec413b2239bdf75177da506fb23ded",
    "http_status": 200,
    "parser_version": "graduation-rules-1.0.0"
  }
}
