{
  "department_code": "B5020",
  "department_name": "海洋生物科技暨資源學系",
  "degree_level": "bachelor",
  "entry_academic_year": "114",
  "minimum_graduation_credits": 128,
  "required_course_ratio": null,
  "source": {
    "url": "https://selcrs.nsysu.edu.tw/stu_query/crs_mst_qry/crs_mst_query.asp?action=3&YY1=114&DPT1=B5020",
    "retrieved_at": "2026-08-22T15:34:07Z",
    "binary_sha256": "0aeeab77a4d51bd103db1ec31452501aa0b16d204b4a636cd99a8e10182fdb90",
    "http_status": 200,
    "parser_version": "graduation-rules-1.0.0"
  }
}
