{
  "department_code": "B6060",
  "department_name": "政治經濟學系",
  "degree_level": "bachelor",
  "entry_academic_year": "114",
  "minimum_graduation_credits": 136,
  "required_course_ratio": null,
  "source": {
    "url": "https://selcrs.nsysu.edu.tw/stu_query/crs_mst_qry/crs_mst_query.asp?action=3&YY1=114&DPT1=B6060",
    "retrieved_at": "2026-08-22T15:34:07Z",
    "binary_sha256": "b7ac2cd02f2bdb46c21b98affd1a1b58440acf953a6152cb9f596e4b78e100e1",
    "http_status": 200,
    "parser_version": "graduation-rules-1.0.0"
  }
}
