{
  "department_code": "B2030",
  "department_name": "物理學系",
  "degree_level": "bachelor",
  "entry_academic_year": "115",
  "minimum_graduation_credits": 128,
  "required_course_ratio": 71.88,
  "source": {
    "url": "https://selcrs.nsysu.edu.tw/stu_query/crs_mst_qry/crs_mst_query.asp?action=3&YY1=115&DPT1=B2030",
    "retrieved_at": "2026-08-24T13:41:35Z",
    "binary_sha256": "3308d438958ad70d9385b1a43b3c6446f9d713ff2dc951c82526da58f750fbba",
    "http_status": 200,
    "parser_version": "graduation-rules-1.0.0"
  }
}
