{
  "department_code": "B2010",
  "department_name": "生物科學系",
  "degree_level": "bachelor",
  "entry_academic_year": "115",
  "minimum_graduation_credits": 128,
  "required_course_ratio": 57.03,
  "source": {
    "url": "https://selcrs.nsysu.edu.tw/stu_query/crs_mst_qry/crs_mst_query.asp?action=3&YY1=115&DPT1=B2010",
    "retrieved_at": "2026-08-24T13:41:35Z",
    "binary_sha256": "ff3fed16c7de549d95e07541e81374fdd769fb3422d605926b4082bf25ef3a1d",
    "http_status": 200,
    "parser_version": "graduation-rules-1.0.0"
  }
}
