{
  "department_code": "B8010",
  "department_name": "學士後醫學系",
  "degree_level": "bachelor",
  "entry_academic_year": "113",
  "minimum_graduation_credits": 174,
  "required_course_ratio": null,
  "source": {
    "url": "https://selcrs.nsysu.edu.tw/stu_query/crs_mst_qry/crs_mst_query.asp?action=3&YY1=113&DPT1=B8010",
    "retrieved_at": "2026-08-22T15:34:07Z",
    "binary_sha256": "2f046208e8375cae349f6c3aa67b9dba4680a17cf32066abaca6c286dfaf0cf6",
    "http_status": 200,
    "parser_version": "graduation-rules-1.0.0"
  }
}
