{
  "department_code": "B3010",
  "department_name": "電機工程學系",
  "degree_level": "bachelor",
  "entry_academic_year": "112",
  "minimum_graduation_credits": 132,
  "required_course_ratio": null,
  "source": {
    "url": "https://selcrs.nsysu.edu.tw/stu_query/crs_mst_qry/crs_mst_query.asp?action=3&YY1=112&DPT1=B3010",
    "retrieved_at": "2026-08-22T15:34:07Z",
    "binary_sha256": "bab7f026260397d1f2db3bfe1f92c6e2583a2f043a0ab43f3015389326fc8fdd",
    "http_status": 200,
    "parser_version": "graduation-rules-1.0.0"
  }
}
