{
  "department_code": "B2020",
  "department_name": "化學系",
  "degree_level": "bachelor",
  "entry_academic_year": "115",
  "minimum_graduation_credits": 128,
  "required_course_ratio": 61.72,
  "source": {
    "url": "https://selcrs.nsysu.edu.tw/stu_query/crs_mst_qry/crs_mst_query.asp?action=3&YY1=115&DPT1=B2020",
    "retrieved_at": "2026-08-22T15:34:07Z",
    "binary_sha256": "e1dd399f300233bf264e8796301de99b3d5b7b6d915af73f3cce673dfb990959",
    "http_status": 200,
    "parser_version": "graduation-rules-1.0.0"
  }
}
