{
  "department_code": "B4030",
  "department_name": "財務管理學系",
  "degree_level": "bachelor",
  "entry_academic_year": "115",
  "minimum_graduation_credits": 140,
  "required_course_ratio": 65.0,
  "source": {
    "url": "https://selcrs.nsysu.edu.tw/stu_query/crs_mst_qry/crs_mst_query.asp?action=3&YY1=115&DPT1=B4030",
    "retrieved_at": "2026-08-24T13:41:35Z",
    "binary_sha256": "0235e0a39fe69d33a03a3dc58ae64e8d169db3a321c4e8de935cca87991fd119",
    "http_status": 200,
    "parser_version": "graduation-rules-1.0.0"
  }
}
